text,label
"Biển không_thể lên thăm cầu_vồng , còn cầu_vồng lại có_thể",0
Tin_vui nhất trong ngày ! ! !,0
Không đẹp nhưng nhiu options,0
"Cá_nhân tôi càng thấy các cô muôn phần đẹp hơn trên ảnh , bởi cái đẹp tự_nhiên , nếu có cũng rất ít can_thiệp . Không như các chị_em bây_giờ ra đường cứ đơ đớ , na_ná y_hệt nhau phát ngán .",0
Sevilla thắng loạt đá luân_lưu 5-4,0
Trông màu nướng rất đẹp . Tương_lai bé sẽ kinh_doanh được rồi,0
Con_cái Trump thật tuyệt !,0
Cần điều_tra và truy_cứu trách_nhiệm hình_sự cả người mẹ lẫn cơ_sở nạo_phá thai ! ! !,0
"Quá chuẩn . Cần thực_hiện ngay , đánh_giá và nhân rộng .",0
Chúc con mau_chóng hồi_phục sức_khoẻ nha cậu bé Hulk,0
"dịch_vụ sữa chữa uy_tín mới mong phát_triển và canh tranh dc với các trang thương mai điện_tử , giờ mọi người đã dần thay_đổi thói_quen đi mua tiệm và chỉ khi nào hỏng thì họ mới ra tiệm .",0
"Khi chưa có phân_bón hoá_học , thuốc bảo_vệ thực_vật thì cá , tôm , cua , ếch ... trên những cánh đồng nhiều nhiều lắm . Giờ thấy bài viết đăng lên thấy nhớ cái thuở ngày_xưa",0
"Trong cuộc_sống cũng thế thôi , những người thiếu tự_tin thường hay ngắt lời , dùng vũ_lực , không để cho người khác cơ_hội nói . Đôi_khi điều này cũng có_thể làm cho họ thắng hoặc ít_nhất không cho đối_thủ thể_hiện mình , nhưng thực_tế là họ không dám để cho người khác nói , còn kết_quả ra sao thì bầu xong mới biết được .",0
Vái trời ông đừng chấn_thương . NHA khốc_liệt hơn nhiều và Bale ko còn trẻ khoẻ như xưa,0
Cá_nhân mình thì thích i10 hơn . Không biết chủ tus đi morning thấy sao chứ mình thấy bí và ồn lắm . Lại còn xe cũ thì càng khó ưng,0
Ko phải con mình thì mình có đc khóc ko ? Mừng cho 2 bé quá,0
Báo con đáng yêu quá giống y_như con mèo con : ^ *,0
"Giảm số đầu điểm sẽ có bất_lợi cho HS là muốn gỡ điểm không được . Nhiều HS cứ kiểm_tra xong hay bảo bài sau em cố cô cho em gỡ điểm nhé ( khá nhiều đấy ) , giờ không thực_hiện được nữa . Thông_tư có điểm chưa rõ , không biết đây chỉ là số đầu điểm tối_thiểu thôi hay_là bắt_buộc chỉ được phép có tối_đa 6 đầu điểm . Vì bình_thường , quy_định cũ thì tối_thiểu 1 điểm miệng , nhưng thực_tế có HS có đến 2-3 đầu điểm miệng do em đó xung_phong lên bảng làm bài nhiều lần , thực_ra như_thế rất có lợi cho HS . Còn việc đưa thêm môn Ngoại_ngữ vào tiêu_chuẩn HS giỏi thì có lợi cho HS nào giỏi Anh . Trước quy_định HSG bắt_buộc 1 trong 2 môn Toán hoặc Văn phải được 8,0 trở lên , nay quy_định mới là ít_nhất 1 trong 3 môn Toán , Văn , Anh phải được 8,0 .",0
Anh_em Lào ko bị gì chúc mừng,0
Attrage đi bạn . Bản AT khoản 500tr biển số tỉnh . Chạy rất ok . Kiểu_dáng đẹp và hàng nhập thailand . Mua vios chỉ được bản thấp MT .,0
Đừng đỗ thừa đó bão . Tôi thấy một_số trường_hợp chết sau bão do thiếu an_toàn khi lợp lại mái nhà thôi,0
"Bây_giờ ông Trump lại có thêm kẻ_thù rất nguy_hiểm là nCoV , hy_vọng ông vượt qua mọi đối_thủ của mình .",0
XL7 lợi_thế hơn 5+2 . Nhưng kinh_doanh dịch_vụ xe mau hỏng thì dịch_vụ sau bán hàng + phụ_tùng thay thế thì Kia_Thaco đáp_ứng tốt hơn Suzuki rất nhiều lần . Bạn nghĩ sao cái cần_câu cơm của bạn nằm xưởng chờ phụ_tùng 1 đến 2 tháng ? Lúc đó thì mang nợ .,0
Tội cho 2 ông giữ xe .,0
"Hack não hơn cả Inception . Đúng là phim của Nolan tốn tiền vé quá , bỡi phải xem_lại nhiều lần .",0
"không sao cả . TT Trump sẽ hồi phục mau chóng . Tháng mười trong năm bầu cử thường thì có nhiều "" ngạc nhiên "" ... tháng mười chỉ mới bắt đầu ... cuộc tranh_đua chỉ mới bắt đầu gay cấn ...",0
"Này mới thật_sự gọi là cá , giờ thấy toàn cá nuôi không . Nhìn rổ cá_rô kia_mà kho với ba chỉ ăn thì cơm nào cho đủ",0
Thấy chị bên cạnh như cầm chiếc smartphone nhỉ ?,0
Thương về miền trung,0
Đau_đớn quá .,0
"Người tài_đức ... thường đoạn mạng , tiếc_thương cho anh và anh Paul_Walker ! ! !",0
"Vĩnh_biệt em , thần_tượng của tôi .",0
"Bước lên đỉnh đã khó , duy_trì nó còn khó hơn , chúc Bayern tiếp_tục duy_trì sức_mạnh của mình ở mùa bóng này !",0
""" Nhưng khi Virgil_Van_Dijk có_thể phất quả bóng dài tới 50m cho Mohamed_Salah , Liverpool là không_thể ngăn_cản . Đó là chất_lượng thực_sự của Liverpool . Họ chi tiền đúng cho người mình cần trên thị_trường chuyển_nhượng để nâng_cấp đội_hình "" . Chuẩn lun kaka : V",0
"Lời thơ xúc_động , âm_nhạc truyền_cảm và người trình_bày có hồn làm_nên 1 MV thực_sự hay .",0
"Bão mà vào miền trung lúc_nào sức tàn_phá cũng nặng_nề hơn mấy chỗ khác . Hi_vọng các tỉnh miền trung sẽ hạn_chế thấp nhất thiệt_hại , chứ đợt bão này thấy mạnh quá",0
"American number one ! Siêu_cường số_một thế_giới ,",0
"Đúng là mỗi thời mỗi khác , mỗi thế_hệ có những thị_hiếu khác nhau . nhưng_mà âm_nhạc bây_giờ cứ như thế_này bảo sao các cô gái chỉ thích yêu bad boy",0
"Căn_hộ giá rẻ nhanh xuống_cấp , thiết_bị công_cộng lẫn lắp_đặt sẵn hư_hỏng không ai sửa_chữa . Đội quản_lý chung_cư yếu_kém , hàng_xóm léo_nhéo không khác gì lúc tôi ở khu ổ chuột.Không có tiền thì để tiền đó ở trọ , số còn lại nghĩ cách làm_ăn , mua đất ven ven xây mái nhà nhỏ cũng ok.Tiền nào của nấy , đừng vì ham rẻ mà rước bực vào người . Bệnh thêm , tổn_hại tinh_thần . Tổng_kết lại , tôi bán rồi he he",0
"Có cầu , có đường hoàn_chỉnh thì nơi đó sẽ phát_triển",0
Cần xem_xét các bar,0
"Trộm_vía các con đáng yêu quá , luôn khoẻ_mạnh và vui_tươi thế_này nhé",0
Pháo_thủ năm nay xuống hạng nha bà_con,0
"Thật tuyệt_vời , chúc_mừng các chiến_sỹ ,",0
"Real hãy làm thế vs Cr7 , Bale ...",0
"Đu bằng sợi dây rất khó , đang học phòng cháy chữa_cháy xong xung_phong lên làm demo liền vẫn khó , không đơn_giản , trẻ khoẻ còn ok . lớn_tuổi thì thua , cần phải có thang dây , không có đu dây mà tuột tay cũng toang nhất_là chung_cư , toàn nhà cao_tầng hơn sẽ rất khớp càng khó xuống .",0
"Xe cũ cứ Toy mà chiến , Vios thẳng tiến nếu có biển số vàng thì càng quý_hiếm nên mua ngay , giá nào cũng mua",0
Tôi thấy trong dịch Covid-19 này có 1 điểm chung ! tất_cả các nơi bị dịch_bệnh tàn_phá mạnh nhất đều là các quốc_gia đã và đang là các đế_quốc hùng_mạnh trong lịch_sử và hiện_tại ...,0
"Nhận định của các chuyên_gia về nguyên_nhân lây_lan Covid-19 rất đú ng.Trên thực tế , hầu như Không thể ngăn chặn được , vì chỉ cần 1 người không tuân thủ các quy định , thì sẽ sụp đổ tất cả . Các nước lây_lan nhiều , chính là vì người dân không tuân thủ các quy đị nh.Ba ̀i toán LỢI và HẠI , cần cân nhắc kỹ lưỡng",0
"Vẽ ai cũng giống nhất_là Thanh_Lan và NC Tín , trừ Thái_Thanh .",0
"300 triệu mua tốt luôn , xe này đi đầm chắc và rất lành , bản số sàn ăn khoảng 7 -8 lít cho 100km là chấp_nhận được",0
Ngoài clb HN thấy chuyên_nghiệp . Phần còn lại thấy như giải bóng_đá phố huyện .,0
"Kane vs_Son đang bá quá rồi , bạn về đây chỉ đi đánh golf là hợp_lý",0
Sự hiểu_biết của con_người về vũ_trụ còn quá ít vì chỉ mới có 5 giác_quan . Vậy cần thêm nhiều máy_móc để có_thể phát_hiện thêm điều mà con_người chưa cảm_nhận được . Đó là vật_chất tối và năng_lượng tối .,0
Mừng vì thời nay VN đã có rất nhiều diễn_viên hay,0
"Bài hát Buồn làm_chi em ơi có giai_điệu nghe như Hồ Quảng trong các bài hát_tuồng , hát_bội của Nam_bộ vậy , nó dễ nghe , quen tai ... và nghe thấy thấm với các bài hát buồn ...",0
Tôi thì ước từ Nguyễn_Đình_Chiểu sang tới Nhà_Rồng ( bắc_nam ) Hai_Bà_Trưng - Trương_Định ( đông_tây ) cho nó thoáng_đãng . Nơi ấy sẽ dùng xe bus điện xe_đạp và đi bộ thôi .,0
Hy vong lần này chúng_ta sẽ khống_chế hoàn_toàn được Covid 19,0
Tội cháu quá ! Sinh mà không nuôi thì xã_hội tiếp_nhận cớ_sao bỏ_rơi cháu ! Cơ_quan_chức_năng nên xử nặng những trường_hợp này . Cháu Tôi chỉ bị muỗi đốt là Tôi đau_lòng,0
"Con Grandeur 2020 hay còn có tên khác Hyundai_Azera trang_bị và tính_năng , nội_thất thì chấp hết mấy dòng ES hay cả LS của Lexus mà nó cũng chả thèm xếp vào thương_hiệu hạng sang . Thế mới thấy mấy bác Nhật chỉ giỏi loè người",0
"thương_hiệu oách , cao_cấp hơn kiểu hàng_hiệu Dior , LV nhưng ít người biết . Kiểu này mới là đỉnh_cao của hàng cao_cấp !",0
Ôi tiền nhiều quá ! Chia nhau rung đùi ngồi đếm còn gì sướng hơn : D,0
Ảnh_Mùa thu suối Yến cảnh đẹp người càng đẹp . Cám_ơn tác_giả .,0
Tuyệt_vời . Xin chúc_mừng các bệnh_nhân và đội_ngũ Y Bác_sỹ !,0
Bão_cát to có nồng_độ bụi gần đặc quánh sao mà thở ?,0
Ủa ? Gia_đình Phạm_Nhật_Vượng đâu ? Tài_sản phải hơn 10 tỷ USD mà,0
chỉ sợ ông không ra trường đc .....,0
Sản_phẩm này đáng_ra phải được thu_hồi triệt_để . Hy_vọng không ai bị nguy_hại sức_khoẻ vì sản_phẩm này nữa . công_ty đưa sản_phẩm này ra thị_trường bị xử_lý ra sao,0
Thương cho một tương lai.Trẻ em cực_kỳ ghi_nhớ những hành_động thế này.Nhìn biểu_hiện và động_tác là bé đã hình_thành thói_quen rồi.Rất mong cha_mẹ của bé từ vụ này dùng tình_thương để giáo_dục lại cho bé .,0
I love FC barcelona,0
"như trường_hợp mẹ chồng tôi mất cũng không để lại di_chúc nhưng vợ_chồng tôi lại sống với bà , 4 chị_gái của chồng đều lấy chồng tỉnh xa , giờ đòi quyền chia đất ... lúc mẹ chồng tôi còn sống con gái thứ 4 có vay bà 50.000.000 , chị_gái thứ 2 vay bà 12trieu đến khi bà mất chưa trả giờ đòi chia đất . còn chị cả lấy đi 1/3 số tiền phúng_viếng . liệu 3 chị này còn đáng đòi đất ko ?",0
Có_thể rất nhiều bạn chưa hướng_dẫn cho các bé.Đây là clip rất hữu_ích xin cảm_ơn bài viết .,0
"Giờ ms biết con này là cua ẩn_sĩ , trước_kia toàn gọi là ốc mượn hồn / mượn xác",0
"Xác_định đi trong thành_phố hoặc đi tỉnh gần thì với 500 triệu bạn có_thể chọn các xe hạng A và B của Nhật đảm_bảo các tiêu_chí của mình về giá , tiết_kiệm xăng , ít hỏng vặt . Đổi lại , độ tiện_nghi , cảm_giác lái không nhạy . Liệt_kê ra thì thấy có Attrage của Mitsu thì xăng tiết_kiệm nhất , xe nhẹ , dễ lái tuy_nhiên trông hơi cổ_điển . Theo tên thì chắc bạn là con gái nên cũng có_thể cân_nhắc Brio , trong tầm tiền , thương_hiệu mạnh , khá bắt_mắt tuy giá hơi cao trong phân khúc .",0
China sẽ không có lợi với động_thái này .,0
"Hit nhiều lắm , kiếp ve_sầu , còn lại 1 mình , bóng_dáng thiên_thần , đi về nơi xa , mưa trên cuộc tình , trở_lại phố cũ , hôn môi xa , kiếp rong buồn , cuộc tình cay_đắng , phiêu_du , bước chân lẻ_loi ...vv...vv thôi không kể nữa mỏi ... tay lắm",0
@ - @ nhìn bánh của ông hấp_dẫn hơn mấy loại bán tràn_lan ngoài đường,0
Ôi thời_gian ! Tài_tử và minh_tinh cũng không tránh khỏi sự tàn_phá của thời_gian,0
"Attrage_CVT 2020 bạn nhé ổn nhất trong tầm giá 500tr . Tôi đang đi và thấy hợp_lý . Với xe tầm 500tr thì không đòi_hỏi được nhiều đâu , mấy anh bàn_phím tư_vấn kiểu chưa đi xe bao_giờ , chỉ nghe nói rồi lên chém ồn , thùng tôn ... nhưng hay hiểu tầm tiền 500tr ko thể đòi_hỏi như e 1ty được đâu",0
Nỗi đau bất_tận !,0
"Mẹ của chú ấy đẹp quá , sanh điệu nữa .",0
Ước gì hình của Đức Phật_Thích_Ca được phục_dựng để thế_giới chiêm_ngưỡng .,0
Chắc_chắn sau khi chữa khỏi bệnh ông sẽ có kháng_thể virus tự_nhiên trong người và sẽ miễn_nhiễm với bệnh này .,0
nước mỹ cần một tổng_thống như trump,0
"theo tôi nên tước bằng lái vĩnh_viễn hoặc có thời_hạn 5,10 năm .",0
Cầu mong ông sớm bình phục .,0
Nằm giữa 2 ca_khúc đình_đám Đi về nơi xa & TìnhTrước bài SIÊU HIT ĐI VỀ NƠI XA thì có các hit đình_đám ko kém 1 . Kiếp ve_sầu 2 . Mưa trên cuộc tình 3 . Bước chân lẻ_loi 4 . Còn lại một_mình 5 . Tâm_hồn xao_động 6 . Hôn môi xa 7 . Bóng_dáng thiên_thần 8 . Email tình_yêu 9 . phong_ba tình đời 10 . phiêu_du 11 . chờ trên tháng năm 12 . lời ru tình 13 . cuộc tình trong cơn mưa . 14 . dòng sông băngTiếp tới giai_đoạn 2003 ra_đời SIÊU HIT TÌNH_KHÚC VÀNG và sau đó còn siêu phẩm MÃI_MÃI MỘT TÌNH YÊU.Với cá_nhân mình anh Bo có 4 bài HIT đình_đám nhất mà ai cũng biết 1 . KIẾP VE_SẦU - lúc đó a là hiện_tượng 2 . ĐI VỀ NƠI XA - giúp anh là Ngôi_sao 3 . TÌNH_KHÚC VÀNG - đưa anh lên đỉnh_cao số 14 . MÃI_MÃI MỘT TÌNH_YÊU - giúp anh duy_trì đỉnh caoSau đó a vẫn còn nhiều bài hát rất hay nữa nhưng mình ko liệt kê.MÌNH PHAN A BO 21 NĂM.THEO DÕI ANH TỪ NĂM 1999 ĐẾN GIỜ,0
Cha trời sao mới tiêm ngày 7 mà bữa_nay lại cho tiêm lại rồi ít_nhất phải 2tuần,0
Sao họ vẫn lạc_hậu như thời trung_cổ vậy ?,0
Xe lắp_ráp trong nước làm gì có mấy hệ_thống này đâu,0
Hồng_nhan_bạc_phận . Tiếc_thương cô gái xinh_đẹp dù biết rằng a và e ko biết nhau,0
Bài hát đầu_tiên nghe a hát là Kiếp_Ve_Sầu .. đến h 34t nhưng bài nào của anh mình cũng hát được .,0
"David_Moyes ơi , ông định đi trước Mourinho sao ?",0
"Thương em bé , chúc em luôn bình_an !",0
Các bạn hãy mua tivi 8k để xem thật kỹ M10 đã cống_hiến những pha bóng tuyệt_vời ra sao nhé . Toàn mấy thánh gato chẳng biết gì cũng xem rồi lên chê M 10 . Mãi yêu Liv.Si,0
"Theo tôi vấn_đề lây_nhiễm cộng_đồng có_thể là do các đối_tượng nhập_cảnh bất_hợp_pháp qua đường_biển , đất_liền , nạn đưa người nhập_cư trái phé0 vào Việt_Nam mới là vấn_nạn lớn . Hãy cứ mở_cửa cho các chuyến bay Quốc_Tế về Việt_Nam nhưng hãy cách_ly lên tới 28 ngày như 1 số nước vẫn làm để hạn_chế tối_đa nhất các mầm bệnh không có triệu_chứng .",0
"Dưới bàn_tay xuất_sắc của hoạ_sĩ đã thể_hiện hình_ảnh các nhân_vật trong tranh y_như thật , quá tuyệt_vời . Xin trân_trọng .",0
"Mình vẫn thích bánh_trung_thu truyền_thống hơn , vì ăn ngon khi uống với trà . Đặc_biệt là khi ăn phải cắt 4 cắt 5 ra chia_sẻ tạo nên sự ấm_áp và ý_nghĩa sẻ chia trong gia_đình : )",0
"Nghe mà đau_lòng , mong con sẽ bình_an sống với bà ! !",0
"tốt nhất chạy thử bác ơi , chứ cũng khó chọn ghê , mỗi xe 1 thế mạnh mà",0
"Bayern mạnh vậy thứ gì chịu nổi , thua đi cho cân_bằng",0
"Em thấy các phụ_huynh bảo phải đi học thêm ngoài con mới theo kịp được . Con_em năm nay 5 tuổi , ham chơi , nên tiếp_thu chậm . Em phải ra_hiệu sách mua bộ_cánh diều cho bé làm_quen trước . Con nhà người ta học 1 năm thì con nhà em phải học 2 năm .",0
Sevilla sẽ đập Bayern 8-2 cho chừa cái tội bắt_nạt !,0
"Bạn mua vừa để đi cá_nhân vừa để chạy dịch_vụ thì tốt nhất nên mua i10 vì so với fadil nó rộng_rãi , bền_bỉ và tiết_kiệm hơn nhiều .",0
Mối quan_hệ phức_tạp quá,0
"Dân Hàn ghê thật , cứ y_hệt như điện_thoại sam sung vậy .",0
"Báo về , gió cuốn nhà bayHằn in trong trí_nhớ ngày ấu thơCha dặm mái , mẹ thẫn thờGió rong mưa đổ phất_phơ lúa đồngQuê hương ngày đó thuần nôngTrông vào hạt thóc làm công nuôi người.Nặng tình ta nhớ khôn nguôiMỗi lần nghe bão lặng người xót_xa .",0
"Vô được bách_khoa là bình_thường , nhưng học ra trường hay không là chuyện khác . Chổ mình có một em bị đuổi học năm 2 vì học không nổi . Sau đó ở nhà ôn thi 1 năm thi đậu bác_sỹ y_khoa đại_học y_dược tphcm . Không trường nào đuổi học nhiều bằng bách_khoa đâu nguyên_nhân học ko nỗi",0
Tôi bận lắm ! Thỉnh_thoảng ngoi lên cho mọi người biết tôi vẫn ổn,0
Lại bão nữa sao ....,0
"Rất đồng_tình với các ý_kiến đã nêu . Cần thực_hiện nghiêm_túc và qui trách_nhiệm cụ_thể với từng đơn_vị trong phòng_chống dịch , cộng thêm ý_thức người_dân .",0
Mong ngài sớm bình_phục . Và kính chúc ngài trump sẽ chiến_thắng trong cuộc bầu_cử tổng_thống sắp tới .,0
A di đà phật .,0
Sao tội cho các cháu quá ! ! !,0
"Thêu tay kì_công quá , chắc giá cũng không hề rẻ , nhưng mặc lên người chắc sang và xứng_đáng đồng_tiền lắm đây . Thương_hiệu này không biết ở VN đã có chưa nhỉ",0
"Giai_đoạn này theo mình nên đầu_tư tài_sản có tính thanh khoản cao trong ngắn_hạn đón_đầu bong bong tài_sản ( vàng , chứng_khoán ) . BĐS có_thể đầu_tư vào cuối năm sau .",0
Bản Seltos_Lux mà bị cắt option thì hơi buồn cười.Ngay cả cái cam lùi và màn_hình nó cũng cắt trong khi sắp tới luật yêu_cầu tất_cả xe ô_tô phải có cam lùi .. Hài,0
Nước mỹ cần tổng t cứng_rắn như trunp,0
Mong là ưu_tiên cho các nhà_thầu trong nước thi_công .,0
Tuyệt_vời trí_tuệ Việt_Nam ! Xin chúc_mừng các nhà_khoa_học ĐHBK HN và cộng_sự !,0
Cứ mặc_kệ nó là nó ổn .,0
Thật_sự là khó đoán và mơ_hồ ! Nhưng có_khi lại có lợi cho ông Trump khi mạnh_khoẻ trở_lại .,0
Ông Real mua_bán khôn quá .,0
"Nguyên_nhân có_thể là : Con_người cho rằng , cá_voi sát_thủ là loài săn mồi đỉnh_cao ở đại_dương và không có kẻ_thù tự_nhiên xứng tầm nào ngoài con_người ( theo Wikipedia ) . Vậy ai sẽ là số 1 , khi tất_cả đang làm mọi cách để trở_thành ? ) )",0
Bên Đức thì trước khi gọi cảnh_sát tới còn phải đắn_đo vì người gọi cho cảnh_sát phải trả lệ_phí 60 ( tuỳ_thuộc vào tình_huống ) .,0
"lãi_suất tiết_kiệm đã quá thấp , rút ra đầu_tư đất hay nhà cho thuê là rất hợp_lý lúc này .",0
Chờ đến cuối năm nay,0
đại_học bây_giờ vào rất rất dễ . 80-90% các em đậu tốt_nghiệp đều có_thể học đại_học dc nếu muốn .,0
Hút ai thì ko biết chứ bạn_bè tôi kinh_doanh riêng hoặc lỡ đầu_tư bđs có dùng đòn_bẩy tài_chính thì giờ đang dở_khóc_dở_cười vì doanh_thu sụt_giảm nghiêm_trọng nhưng nợ vay vẫn phải trả đều_đặn .,0
Thiếu tính liên_hoàn như phố đi bộ quanh Hồ Gươm .,0
Tuổi_thơ của tôi,0
"Tôi hơn Nhã_Kỳ 2 tuổi , 2 đứa con , 1 anh chồng , một mái ấm nhỏ gọi là nhà . Còn tiền_bạc , tài_sản , nhan_sắc , hào_quang và sự nổi_tiếng đều kém Kỳ . Nhưng tôi không đánh_đổi đâu .",0
"Chiếc xe vừa là phương_tiện đi_lại , vừa là tài_sản khi cần để bán lại , và là sự tự_hào của mỗi chúng_ta nên theo tôi nghĩ mua xe có thương_hiệu vẫn hơn .",0
"Rất may là bị công_an bắt , chứ để dân hay có_thể sẽ có chuyện không vui cho người_dân và bọn này .",0
"đau_lòng quá , cầu_mong linh_hồn 2 chú được an_nghỉ , cầu_mong em sớm hồi_phục và vượt qua nạn này ,",0
"Cứ theo như thông_tin của bệnh_nhân số 32 về từ UK thì bên đó con_số không phải là hơn 300 như thống_kê , vì bệnh_nhân có yếu_tố dịch_tễ có triệu_chứng điển_hình như_thế mà không xét_nghiệm vẫn cho cách_ly tại nhà . Chỉ xét bệnh_nhân này thôi đã có_thể lây_lan ra rất nhiều người khác rồi .",0
"Mong khoa_học phát_triển nhanh_chóng cho nhân_loại khổ_đau nhờ . Cám_ơn đội_ngũ y_tế ! Chúc cả nhà_may mắn , thắng_lợi ! ! !",0
Con cá này mà bắt được nhỉ !,0
Nên có một hình_thức phạt xứng_đáng cho những kẻ dùng ma_tuý này thôi .,0
Tâm_lý của người có con năm sau vào lớp một cảm_thấy bất_ổn .,0
"Xin chia buon , quá đau_lòng .",0
10 gia_tộc thì đã có 6 gốc Hoa .,0
Đúng là sống có điều_kiện từ bé lớn sẽ tránh được cám_dỗ . Tôi đã trải qua nên rất đồng_ý,0
Mặt vậy bảo sao . Khổ thằng bé thôi .,0
"Những trận cầu như này , cần những ngôi_sao lên_tiếng . Như_vậy mới thấy , trạn cầu khó_khăn , đội_hình có cá_nhân xuất_sắc , sẽ thay_đổi cục_diện trận đấu .",0
em i10 này quá đẹp so với phần còn lại . Em ko có thành_kiến gì về hãng .,0
ở bên nhật 3 tuổi mới tiêm viên não Nb sao ở vn 1 tuổi lại tiêm,0
"Cũng không thay_đổi nhiều lắm , 20 năm như_vậy là thay_đổi rất ít . Phim này xem vài lần rồi vẫn không chán . Thật sinh_động và hài_hước .",0
"Mua_Honda_City đi bạn , đời 2014-2015 khoảng tiền đó , nhưng xe Nhật ít hư_hỏng vặt .",0
"sợ nhất các "" ông bà bác sĩ "" quyền lực tại gia .",0
"Rất nhiều bác tài tham_gia giao_thông bị báo lỗi sai làn nhưng thực_tế chỉ là không tuân theo biển_báo , vạch kẻ đường .",0
"Trời_ơi , con này là Threshershark , một loại cá_mập đuôi dài cực_kỳ quý_hiếm . Sao có_thể dạt vào sông dc .",0
"15,16 năm gấn bó với Ác_Si có gì để kể không nhỉ ? Mình tò_mò muốn biết !",0
Sao không vào Công_an Phường mà vào bãi giữ xe làm gì cho bị chém,0
Hollywood mau tận_dụng cảnh này đóng phim khỏi dựng cảnh .,0
"bạn gắng thêm tý mua Fadil bản tiêu_chuẩn , số tự_động luôn đi , ngon hơn i10",0
"Điều kì_diệu đã thành hiện_thực . Vui_mừng , xúc_động , cảm_ơn các y bác_sỹ , chúc_mừng 2 cháu và gđ ! Cảm_ơn cả cộng_đồng đã cùng động_viên chia_sẻ nữa chứ",0
"Một người cha tuyệt_vời ! Tình cha như núi Thái_Sơn , nghĩa mẹ như nước trong nguồn chảy ra ! ! !",0
Bạn còn phải hỏi nữa ! bạn cứ chờ 5 năm nữa vàng xuống 35 triệu / cây rồi hãy bán .,0
< 3 < 3 < 3 : ^ * : ^ * : ^ * mê truyện của pác này lắm cơ,0
"Bao_nhiêu năm Bale chinh_chiến gánh Tạ vong ơn , giờ thì kẻ kia lựa đội đầu tóp đáp xuống hô vang câu đi tìm THỬ_THÁCH , còn anh vẫn thầm_lặng trở_lại "" quê nhà "" để gánh_vác đội bóng ở giai_đoạn khó_khăn này , trong khi đã sức cùng lực kiệt đây mới thật là thử_thách cực_đại .",0
"Bản_thân tôi thấy Trump rất nhiệt_huyết và rất tận_tâm vì nước Mỹ , vì người Mỹ hơn những ông tổng_thống Mỹ mà tôi biết như Obama hay Bill_Clinton . So về độ tuổi của ông ta so với 2 người tiền_nhiệm thì ông Trump làm_việc quá tốt rồi .",0
Thương con quá ! Cầu_mong con bình_phục !,0
"Nhớ tới cái lúc mua e kona 2.0 db e thấy cảm_nhận của e nó là bền , đẹp . Thấy kona option nhiều quá lại gầm cao phù_hợp với mục_đích ngoài đi trong nội_thành e còn đi về quê nên thấy ưng quá rước e na về luônn",0
Quan_trọng là bạn muốn gì : 1 . Giá_thành rẻ 2 . Ít ăn xăng 3 . Thương_hiệu 4 . Nhập khẩuThe End,0
Jollibee thì dễ ăn và chất_lượng nhất .,0
