text,label
"Ông hvl mới đang cố mang 1 tiền_đạo đẳng_cấp top thế_giới về chơi vị_trí tiền_vệ kiến_tạo để tạo sự khác_biệt thay_vì kiếm 1 vị_trí tiền_vệ trung_tâm đầy sáng_tạo như xavi hay iniesta , thứ mà barca đang thiếu . Ong có thanh kiếm sắc trong tay nhưng lại dùng nó để làm công cụ gọt_dũa lưỡi gươm khác . Thì ông vừa làm cùn 1 đi 1 món binh_khí thuộc hạng tốt nhất trong hành_trang của ông rồi.Kiếm 1 ông tiền_vệ trung_tâm và 1 thủ_lĩnh hàng thủ , vẫn phát_huy GM cho nước hậu mùa sau nhưng cần duy_trì lợi_thế có trong tay 1 sát_thủ M10 hay M82 mà các thánh đùa đang gọi .",0
Thế_giới động_vật và cuộc chống sinh_tồn cũng thật phong_phú và thú_vị !,0
Nhiều người ủng_hộ hơn mới quan_trọng hơn nhiều tiền hơn nhé,0
pen có đc xem là bàn thắng ko nhỉ ? ? ? ? ?,0
"Mừng , nhưng nghẹn ko nói nên lời .",0
Nhìn vào thấy cầu nhơn_trạch bố_trí là chưa hợp_lí rồi . Đề_nghị xem_lại,0
Khổ_thân cháu bé ..... cầu_mong cháu bình_an ! ! ! ! ! !,0
Cảm_ơn bạn . Chính_xác có đi sai vạch kẻ đường bị báo lỗi đi sai Làn_đường .,0
rồi không_chừng lại như Gary_Neville = ) ),0
Bây_giờ có 2 tỷ chưa chắc mua được căn_hộ dưới 60m2 ở Q. 12 .,0
"2 con đáng yêu quá , cầu_chúc 2 con luôn bình_an .",0
8 > 2 Ok .,0
Tuổi chàng hơn gấp đôi tuổi nàng nhưng nhìn vẫn rất xứng_đôi .,0
Nếu Trump khỏi bệnh sớm sẽ là lợi_thế về mặt sức_khoẻ trong chiến_dịch tranh_cử cử ông . Mong ngài mau_chóng bình_phục .,0
Nên đọc kỹ các điều_khoản ghi trong hợp_đồng . Nếu bạn là người lo_xa thì nên mua .,0
800 triệu sao không mua Xpander_Cross đi cho nó ngon ?,0
Luật_Pháp phải công_bằng và nghiêm_minh . 16 tuổi dùng ma_tuý lái_xe gây tai_nạn chết 2 người mà chỉ 30 tháng tù là nhẹ quá .,0
"Mong rằng sẽ không còn bài viết ca_ngợi như thế_này nữa .. vì sẽ không có đợt dịch nào tiếp_theo nữa , mọi người có vaccine , có thuốc , khoẻ_mạnh và an_lành .",0
Còn thiếu decal tăng công_suất nữa kakaka,0
"Những phim này tôi đều chưa xem . Phim Việt_Nam tôi xem gần đây nhất là phim "" Ma làng """,0
Cuồng quá vậy trời làm gì phải khóc,0
"Với mình nghe từ những ngày đầu anh Trường bắt_đầu ca_hát , từ Kiếp ve_sầu , Kiếp rong buồn .... thì có_lẽ đến 70% các bài đều tạo hit . Giờ lớn đủ thứ phải lo nên ko có thời_gian nghe nhạc 3-4 năm nay , ko rõ những bài a ra tiếp_theo có đc như xưa nữa ko . Với mình thì gắn_bó nhất là Mãi_mãi một tình_yêu , nhờ nó mà mình tán cô nào cũng đổ vì hát giống Đan_Trường ️",0
"Khu dự_án nhà tôi đã qua hơn 20 năm , là một trong những dự_án đầu_tiên của Sài_Gòn ngay quận 2 , đến nay vẫn chưa được cấp sổ_đỏ . Lý_do chủ đầu_tư nợ thuế . Chúng_tôi viết đơn thư tới mọi cấp mọi ngành từ thành_phố , tới bộ_ngành ... đều không ai xử_lý được . Quả bóng vẫn cứ đá qua_lại .",0
"Con gái của Uma_Thurman rất giống mẹ , một trong những diễn_viên ưa_thích của tôi .",0
Khí_chất là chấn_thương và chơi golf chăng ?,0
"Mua xe ô_tô của Nhật nhé , đừng mua công_nông .",0
"Cứ đề_xuất cấm xe_máy , cho đi xe_đạp thì ách_tắc giao_thông còn hơn nhiều , vì tốc_độ xe_đạp rất chậm .",0
"luật của mình còn quá nhẹ cho tội trôm gà và trộm chó , người_dân bức_xúc lắm nhưng không biết làm gì , mong pháp_luật sửa_đổi lại luật , phật thật nặng và cho đi tù thật lâu cho chừa cái tội trôm . cắp .",0
Ai cũng khôn như ông này chắc giờ thế_giới đang đi cày ruộng để kiếm sống rồi và ông cũng không bao_giờ trở_thành tỷ_phú được.Tôi mà tỷ_phú tôi cũng sẽ khuyên các bạn như vậy : ' ),0
Hi_vọng anh không về Ngoại_Hạng để đánh golf .,0
"Nhớ đeo khẩu trang khi ra đường và khi tiếp xúc người lạ , luôn rửa tay bằng nước rửa tay sát khuẩn nhé mọi ngườ i.Chu ̉ động chứ không chủ quan ! .",0
"Lux_SA vận_hành rất tốt , đi êm nhé bạn ! Hơn_nữa thương_hiệu Việt nên việc CSKH và bảo_dưỡng sẽ thuận_tiện hơn và ngày_càng tốt dần trong tương_lai .",0
180 năm ..... không biết ở đâu,0
Thật tuyệt chúc_mừng liverpool . Đội bóng còn hay hơn_nữa,0
"Thật xót_xa . Là phụ_huynh cũng có con như các bé , tôi không cầm được nước_mắt khi đọc tin này . Xin chia buồn .",0
Lúc nhà bị mất chó khóc hết nước_mắt tại_sao lại có những người kiểu này nhỉ,0
"Tội_ARS , vừa loại Liv , lại đụng tiếp MC",0
"Khổ cho bà_con hạ_lưu , chuẩn_bị chạy lũ ..... ?",0
"Luật_pháp không xử_lý hình_sự thật nặng những_ai liên_quan đến an_toàn thực_phẩm thì vấn_đề ngộ_độc và vận_chuyển , phân_phối những thực_phẩm không rỏ nguồn_gốc , hư thối sẽ vẫn còn tiếp_diễn",0
"CS trông như là nguyên_mẫu của búp_bê Barbie cổ_điển ý , đẹp thật .",0
"Vâng , lần sau mời ông ấy thử đè ngạt thở con cá_sấu xem sao .",0
Chúc_mừng bạn . Bạn thật giỏi,0
Cơn bão này hại ngành điện_lực rồi,0
"Có ! Tôi chỉ đoán thế thôi , nếu không có thì thầy đã không so_sánh với diện_tích trái_đất .",0
"Đọc con_số phá_thai hàng tháng mà giật_mình , tốn tiền để lại hậu_quả về tâm_sinh_lý cho bạn nữ . Đã đến lúc giáo_dục giới_tính thực_tế cho các em , dạy các em sử_dụng bao_cao_su khi quan_hệ . Chúng_ta sợ vẽ đường cho hươu chạy nhưng bay giờ hươu đã chạy lạc lối rồi",0
Nếu đá đội_hình mạnh nhất thì Pháo rất khó thắng Cáo . Hi_vọng Pháo vào top 4 mùa này .,0
Mục_đích cuối_cùng UCV nào cũng Make_America_Great again ! Hãy ủng_hộ cho ai có mục_đích đó .,0
con_người thật thần_thánh,0
Đệm_bóng ghi_bàn có được tính là bàn thắng không hả các ông cules,0
Mong cho chúng lãnh án phạt cao nhất mới đủ sức răn_đe .,0
Mọi việc mà có sự phối_hợp của nhân_dân thì quả là hoàn_hảo rồi,0
Thế_hệ tương_lai mà cứ để bị ngộ_độc thế_này thật là nguy_hiểm,0
"Từ ngày đổi chủ , sai gon có diện_mạo mới lon đẹp hơn nhiều dễ uống hơn nhiều và đau_đầu hơn nhiều",0
"nhiều người mua mà ít có ai chịu đọc hơp đồng , chì nghe nhân_viên hót rồi xuống tiền mua , đến lúc khó_khăn muốn huỷ rút_tiền lại là mất_trắng",0
"200 cửa_hàng mà doanh_thu hơn 200 tỷ , nghĩa_là mỗi tháng thu_chi chỉ loanh_quanh 100 triệu thì ko đủ lãi trả mặt_bằng chứ nói gì đến trả lương nhân_viên với lợi nhuận.hơi lạ",0
"Giữa mùa dịch mà có nhà_đầu_tư mạnh vậy , hoan_nghênh quá.Việc làm xây_dựng và vận_tải phát_sinh tạo việc_làm thêm cho nhiều người Việt .",0
May là rắn không có độc không thì cá gặp diêm vương rồi,0
Tôi thì là fan của Toy nhưng trên quan_điểm cá_nhân tôi đánh_giá xe i 10 ( huyndai ) hơn xe Vin,0
"Chỉ_số đổi_mới sáng_tạo của Việt_Nam liên_tục tăng , nên giảm bớt các chuyên_gia nước_ngoài , ưu_tiên đội_ngũ lao_động kỹ_thuật trong nước .",0
"Đúng như dự_đoán , sau các TT thất_bại trước xe Nhật như Mỹ , Pháp , Anh ( và cả Nhật ) thì xe Hàn gỡ lại ở các TT Việt_Nam và Hàn_Quốc . Ngoài 2 TT này thì chỉ có TT Pháp là xe Hàn có 1 xe ( Kia_Sportage ) đứng áp_chót . Đúng là "" xe Hàn dành cho người Hàn "" .",0
"Ở đâu cũng có những kẻ vô_ý_thức , tội_nghiệp con cua bé",0
nên cho_phép chọn đóng 1 lần hoặc nhiều lần để người_dân lựa_chọn,0
"Rất dễ hiểu , mong các bác giao_thông phạt đúng chứ đừng chơi chiêu khiến người vi_phạm hoang_mang là được",0
"Chuyện hài quá , hoàng_đế La mã có kiểu tóc của thanh_niên thế_kỉ 21 .",0
"Cứ xe Nhật mà đi cho nó lành . Còn muốn mẫu_mã optin này_nọ thì nên mua xe Trung_Quốc , về khoản này thì xe Hàn cũng không so được",0
""" Do trước giờ vợ_chồng chỉ đi làm công ăn lương và chưa đầu_tư gì nên cũng đang băn_khoăn liệu bán vàng để mua đất lúc này có hợp ký không ? Ngoài_ra , với số tiền bán vàng trên thì đâu là kênh đầu_tư hợp_lý nhất trong thời_điểm này ngoài đất ? Rất mong nhận được sự góp_ý chân_tình từ độc_giả . "" Như bác nói thì Bác bán gửi tiết_kiệm . rồi lại mua vàng là kênh đầu_tư hợp_lý nhất trong 5 năm tới",0
Cháu xin cụ,0
"Tuy_rằng quan_trọng trong đời_sống , nhưng thì tiền của cũng chỉ là vật ngoại thân , khi chết chẳng mang đi được . Có_thể đến độ tuổi nào đó , con_người ta mới sáng_tỏ , được không quá vui , mất chẳng buồn nhiều , suy cho cùng tất_cả cũng chỉ là bụi đất mà thôi .",0
Nhìn trên phim Hàn ngoài đường đâu_đâu cũng Hyundai,0
"Thái_độ trận mở_màn Bundes đã cho thấy , Bayer muốn lấy nốt chiếc cup này !",0
Chẳng phải làm Doanh_nghiệp thì ai cũng muốn đóng ít thuế nhất hay sao ?,0
Việt_nam là nước xuất_khẩu lai động có nhiều lao_động tại nhật.tình trạng hiện_tại rất nhiều người thất_nghiệp suốt từ đầu năm đã tốn_kém chi_phí cả trăm triệu đồng là gánh nặng kinh_tế rất lớn . Không có biện_pháp kịp_thời giải_cứu công_dân mắc_kẹt sẽ khiến nhiều gia_đình rơi vào cảnh tan_hoang nợ_nần bởi đa_số người đi lao_động đi vì kiếm tiền trả nợ,0
"Bây_giờ các đội bóng Italia đều tăng_cường từ huấn_luyện_viên cho đến các cầu_thủ cả rồi , nên tính cạnh_tranh sẽ cực_kỳ cao , không như laliga quanh_đi_quẩn_lại chỉ vài đội có thực_lực tranh_chấp_chức vô_địch thôi ,",0
Tôi tin Tổng_thống Donald J._Trump sẽ thắng_cử Tổng_thống lần 2 .,0
"Mình không hiểu tại_sao lại ko nhận ra được , khi tro cốt được bỏ vào chậu thì sẽ có hình + tên_tuổi quê_quán chưa ? ? ? ? ?",0
"Không có di_chúc hợp_pháp thì chia đều cho các hàng thừa_kế . Nếu có 2 anh_em sẽ được chia đôi , 3 anh_em thì chia 3 . Cứ thế mà làm .",0
Mấy kiểu này chỉ thích_hợp với một_số người . Không thích_hợp với nhiều người trong đó có tôi .,0
"Bạn nên thuê 2 chiếc chạy thử trong vài ngày , đường ngắn và đường dài , sau đó có_thể tự đánh_giá xem xe nào sẽ phù_hợp với nhu_cầu và sở_thích",0
"Anh cứ lái thử rồi chọn chứ lên đây hỏi xong có_khi lại khó chọn hơn , 9 người 10 ý mà . về cơ_bản thì ngang nhau chủ_yếu khác_biệt ở option",0
Thu_hồi bằng do lỗi nhà_trường thì có trả lại tiền học_phí cho người ta không,0
"Bạn cần 4 chỗ hay 7 chỗ , có 400tr mua xe sao phải mua xe cũ nhỉ .",0
"Tại_sao chúng_ta cứ làm khác người như_vậy , phố đi bộ phải làm ở tất_cả các quận_huyện chứ để các địa_phương tự thiết_kế nó mới đa_dạng và phong_phú , mới hấp_dẫn chứ và để cho tư_nhân đầu_tư .",0
tuổi_thơ mình gắn liền với hai tác_phẩm . dế_mèn phiêu_lưu ký và bẩy viên ngọc rồng . ngoài_ra vẫn còn một_số tác_phẩm khác . cái tết của mèo con . giờ già quá rùi,0
"Hoài_Lâm đã từng có danh_tiếng tiền_bạc . Nhưng những cám_dỗ đã là Hoài_Lâm rời bỏ Gia_đình , Sự_nghiệp . Mong là tỉnh_ngộ để quay đầu .",0
3 thiên_thần CHARLIE . THẬT TUYỆT_VỜI,0
mong anh í để dành sức không ghi bàn giao hữu để bùng nổ trong những trận cầu đinh,0
"Có mấy bạn khuyên mua Nissan Sunny . Tôi khuyên là bạn tránh xa Nissan Sunny này ra , một chiếc xe nhanh tã nhất.Hôm trước Vnexpress có review Corolla_Atis 2011 cũng đc nhưng nếu hay đi đường đèo thì lấy con Ford Ecosport là hợp_lý nhất .",0
Mình cũng đồng_ý là nên cho em ấy về rừng . Em ấy đã quá chán bị nuôi nhốt nên mới năm_lần_bảy_lượt tìm cách thoát_thân mà_lại cứ bị bắt về nhốt . Thật tội_nghiệp .,0
Cả 2 mẫu xe này chỉ thích_hợp trong đô_thị . Nếu đi đường dài và đi với tốc_độ 90 ~ 100 km/h thì 2 chiếc xe này rất đuối .,0
"Nhà Tớ nuôi một con Mèo ... để bắt Chuột_nhắt , Mèo_Tặc bắt mất rồi , Vợ Tớ khóc",0
"1 vai diễn ấn_tượng , 1 nhân_vật cá_tính , câu nói của nhân_vật bà đóng trước khi chết cũng rất chất . RIP và xin cảm_ơn vì đã tạo ra 1 Olenna_Tyrell tuyệt_vời",0
"Bánh hình con vật kia gọi là bánh_bao , gọi bánh_trung_thu nghe ko hiểu nổi",0
Chúc 2 cháu mạnh_khoẻ .,0
Không biết y pnt có cộng điểm ưu_tiên khu_vực không mọi người,0
Rất khoa_học và thực_dụng .,0
Quá tuyệt_vời việt_nam ơi,0
"Nhà mình rất nhiều vỏ mỳ tôm trước có một bạn xin mà giờ không lấy , mình muốn gửi các bạn thì ntn ạ",0
Nhìn bà_cụ bán hàng cực_khổ vậy_mà nó cũng lỡ lòng lấy của người ta .,0
Team học dở Toán giơ tay !,0
"Đây là sự_cố ko do mong_muốn của ai cả , công_ty cũng đang đứng ra giải_quyết sự_cố hết_sức có_thể thì nên động_viên họ thay_vì tiếp_tục chỉ_trích .",0
quá đẹp,0
"Thi , thi nữa và thi mãi để lấy các loại chứng_chỉ . Bao_giờ mới hết cảnh này nhỉ .",0
Cá câu người .,0
Rất tiếc nhiều phân_đoạn đã bị lượt bỏ khi kiểm_duyệt nhưng bộ phim rất hay đối_với những bạn trẻ dưới 30 có_lẽ sẽ không được như kỳ_vọng vì bộ phim không có những lãng_mạn diễn_viên không là minh_tinh điện_ảnh phim nhìn về cuộc_sống SG với một góc_độ khác khiến người xem phải suy_ngẫm,0
"Đan_Trường quá nhiều bài hit luôn , kiếp ve_sầu , đi vê nơi xa , phiêu_du , tình_khúc vàng , dòng sông băng , mãi_mãi một tình_yêu ...",0
Công_an bắt_tội phạm quá siêu .,0
bà_con được lộc tích_trữ cho đợt mưa_bão số 5 này,0
Tưởng anh rủ thầy đi chơi golf chứ,0
Kiếm chiếc innova đời 2015 Đi nhé Bạn . i10 dễ dính xe dịch_vụ lam,0
Tôi thích giọng ca này,0
"Đầu_Gấu đuôi Chồn , quá quý_hiếm .",0
Đây hoàn_toàn là lỗi từ phía các công_ty tài_chính khi không phân_biệt được những hồ_sơ vay vốn kia là giả .,0
Nam_Mô A Di Đà_Phật . Cầu cho các em sớm được siêu_thoát,0
"Cái duy_nhất cộng_đồng có_thể hộ trợ là tích_cực lên_tiếng , cảnh_báo để giảm_thiểu nguy_cơ tiếp_tục có người nhiễm_độc . Còn vấn_đề tài_chính , thuốc_men ... thì Minh_Chay phải chấp_nhận nếu kết_quả xác_minh họ có lỗi . MC kinh_doanh chứ không phải hoạt_động phi lợi_nhuận , và sai_phạm của họ có dấu_hiệu cố_ý trong vấn_đề nguồn_gốc nguyên_vật_liệu , chưa kể đến sản_xuất như kiểm_tra thì không đảm_bảo an_toàn .",0
Năng_lực tới đâu giải_quyết tới đó .,0
Thật khâm_phục anh một ông bố thật tuyệt_vời,0
"Không nên mua Fadil . Lý_do thì tôi không tiện nói ra ở đây , bạn tự tìm_hiểu .",0
Ơ ... ! Sáng nào tôi cũng uống cafe đen từ hơn hai_mươi năm nay rồi !,0
Nếu mua bảo_hiểm mà nói đến chuyện lãi thì không nên mua bạn nhé !,0
"Ma_tuý mà nó mang mấy chục kg , vài chục nghìn viên nghe mà thấy phát ớn",0
"đã tính đến phương_án nếu hỏng_hóc thay_thế chưa , với_lại dòng này cũng "" uống xăng "" đấy nhé",0
Mới sáng đọc được cái tiêu_đề thôi mà cái bụng nó phẻ,0
Khi nào có công_nghệ pin mà có tính kinh_tế gấp hai lần trở lên so với công_nghệ pin chì-axit thì tính tiếp .,0
Chúc_mừng Bayern_Munich : - ) & Xin chia buồn đến Sevilla . Sevilla đã cố_gắng lắm rồi : | thua nhưng không nhục . ; ),0
"Cuối_cùng nó cũng đã đến với nước Mỹ , nhanh hơn dự_đoán cửa tôi rồi . Một nước luôn cho mình là vĩ_đại nhất , tuyệt_vời nhất , chỉ là cúm mùa thôi mà , số người chết vì tai_nạn giao_thông hàng ngày nhiều hơn số người chết vì Covid 19 . Nước Mỹ chúng_tôi có đội_ngũ y , BS giỏi nhất , các trang_thiết_bị y_tế tối_tân nhất , hiện_đại nhất , ... Chỉ vì một số_ít cá_nhân luôn cho mình là vĩ_đại , trên_hết mà người_dân Mỹ phải gánh_chịu , mong mọi người_dân mỹ hết_sức bình_tĩnh , tự mình cách_ly và nên học_hỏi kinh_nghiệm ngăn_chặn dịch_bệnh covid 19 của một_số nước , người_dân hạn_chế ra ngoài đường , đeo khẩu_trang khi đi ra khỏi nhà , thường_xuyên rửa tay bằng dung_dịch y_tế , hy_vọng sẽ sớm kiềm_chế dịch_bệnh Covid 19 .",0
"Nhớ ngày_xưa đi học kiểm_tra vui lắm vừa lo vừa hồi_hộp chờ điểmMấy câu không biết lật "" bùa "" rồi thì_thầm ra dấu chỉ nhau vui lắmGiờ không kiểm_tra sau vui bằng",0
Không nên ! Nhìn mặt_trái của nó đi !,0
Nước giàu chỉ có số tiền không lớn mà không giữ di sản của quốc gia ! Lạ !,0
Cũng chưa khẳng_định đây là tin xấu hay tốt của ông Trump . Có_thể qua đây ông sẽ nhận được sự ủng_hộ của một_số người bất_mãn về covid đột_nhiên quay lại thông_cảm với ông . Hãy chờ xem,0
Kẹt khoá là đau ko có gì tả dc @ @,0
Nhìn Brad mặc mấy bộ này thì đóng James_Bond là quá hợp . Tôi thấy ăn_đứt Daniel_Craig : ' ) B ),0
cột điện dễ gãy quá,0
"Công_ty mình còn không có bánh_trung_thu luôn , phát thịt lợn ý_tưởng quá độc_đáo",0
Loài này là chuyên ăn xác động_vật chết ở biển đây mà,0
"Cách bơi hai cá giống nhau , nhưng động_cơ trái nhau : cá_heo hứng_thú vui_chơi , còn - Tommy đang chịu ảnh_hưởng của hormone và giận_dữ . ( Sấu vẫn hoàn sấu thôi )",0
M10 không ghi_bàn nên BC thắng đậm ! . ^ _ ^,0
"T sẽ chọn Fadil vì : Kiểu_dáng ngoại_thất đẹp hơnMáy khoẻ đi đầm bốc hơn , nhiều trang_bị an_toàn hơnGiá xe đang đc ưu_đãi cũng rất hợp lýchi phí bảo_trì cũng hợp lýỦng hộ thương_hiệu VN ! ! !",0
"Nên cấm Tôi nghĩ hại nhiều hơn lợi , ví_dụ đơn_giản các em dùng điện_thoại nhắn_tin trong giờ học thử_hỏi thầy_cô có quản_lý hết được không , cái hại nữa là làm cho các e lười tư_duy ỷ_lại vào điện_thoại !",0
"Tại_sao phải làm hầm chui . Trong khi , mỗi lần mưa xuống thì đường_phố ngập như sông .",0
Nếu súng nổ thì chuyện gì xảy ra,0
"Đây phải nói là Lâu_Đài chứ biệt_thự cảm_giác không hoành_tráng như "" Lâu_Đài """,0
Thương con quá ! Cảm_kích tấm lòng của nhóm ! Nếu có cơ_hội tôi cũng muốn gia_nhập nhóm .,0
Mua căn_hộ thì tôi thấy được ưu_điểm : trả theo đợt ... trả ghóp . Nhưng nhược_điểm thì nhiều vô_kể ... kể_cả căn_hộ cao_cấp ... Trước_mắt là chờ sổ dài cả mắt ...,0
Đây là chương_trình thi_đấu trí_tuệ nhất việt_nam .,0
Thực_phẩm chế_biến sẵn mà ko có chất bảo_quản thì chỉ 1 thời_gian ngắn rất dễ nhiễm vi_sinh có hại . Đặc_biệt là botulinum . Vi_khuẩn gây bệnh này rất nguy_hiểm . Thực_phẩm chế_biến sẵn phải có chất bảo_quản nhưng với 1 liều_lượng cho_phép ko ảnh_hưởng sức_khoẻ người tiêu_dùng .,0
Xót_xa quá ... Mong các con đến thế_giới mới được an yên !,0
Lập các phòng cách_ly tại_chỗ ngay ! Hạn chế tập_trung !,0
"Với mình nó không_những "" HIT "" mà_còn là tuổi_thơ , kỉ_niệm , tình_đầu và nụ hôn đầu .",0
"Thật là đau_thương , xin chia buồn cùng gia_đình các cháu , cầu_mong siêu_thoát",0
"Nữ diển viên nước_ngoài mà tôi yêu thích nhất , cả về tài_năng , tính_cách , lòng nhân_ái của cô ấy thật tuyệt_vời",0
"Tai_nạn là chuyện bình_thường . Các bạn nào có ý cà_khịa gì đó thì xin hay suy_nghĩ tí . Tiếp dầu trên không là 1 điều cực_kỳ khó , đòi_hỏi tay kỹ_thuật cao và còn phụ_thuộc vào nhiều yếu_tố khác như gió , hoặc vùng nhiễu . Mà trong lúc huấn_luyện thì xảy ra sự_cố để biết mà khắc_phục lúc chiến_tranh là 1 điều bình_thường .",0
Cầu_mong chú và em luôn tích_cực và niềm cảm_hứng cho các bạn bị như_vậy,0
"Một trong nhưng nam diễn_viên điện_ảnh mà tôi yêu thích nhất . Nhớ mãi vai diễn trong bộ phim "" Speed "" với diễn_viên Sandra_Bullock",0
"Cần phạt nặng luôn những quán ăn , nhà_hàng ... thu_mua Chó của bọn trộm Chó này bán luôn ! Phạt tù bọn trộm Chó này nếu ko mạnh_tay thì về sau_này sẽ có nhiều chuyện đáng tiếc xảy ra ...",0
"Mỗi người một vẻ đẹp rất riêng và khác nhau , ai cũng đẹp ! Nhưng em thích nhất vẻ đẹp mặn_mà , đầy_đặn và rất phụ_nữ của chị Thu_Hà .",0
"Tại_sao công_an ko bắt khẩn_cấp luôn mà phải triệu_tập , tội này rất nghiêm_trọng mà ?",0
Rất mong và cầu chúc cho ngài Biden sẽ đắc cử và trở thành tổng thống nước Mỹ . Đó là điều phù hợp với sự mong muốn không chỉ riêng người dân Mỹ mà nhân_dân toàn thế giới cũng đang rất mong chờ . Cầu chúc ngài may mắn và hết sức cố gắng !,0
"Quá nhiều em không theo kịp , con tui học trước 1 năm mà thấy đuối .",0
"Đừng cố_gắng sinh con khi không_thể yêu_thương , nuôi dạy và bao_bọc những đứa trẻ đáng được hưởng đầy_đủ những yếu_tố cơ_bản nhất",0
"Có ai theo thuyết âm_mưu không ? Hay cũng_nên thông_cảm cho ông ấy , vì đã 78 tuổi rồi , cái tuổi thất_thập cổ_lai_hy .",0
"Còn đâu những cồn cát dài , trắng , hoang_sơ khi xưa khi trốn tiết cùng lũ bạn lăn_lộn nơi đây .",0
"Hoa mướp hay các loại hoa khác không có độc và vẫn được con_người chế_biến thành món ăn , nhưng hồi xưa lúc còn rừng_núi hoang_sơ nghe người_lớn nói lại rằng nếu háu ăn không rửa cẩn_thận sẽ bị độc do các côn_trùng hay rắn nhả độc trong đó và lúc xưa đó cũng có nhiều người trúng_độc do ăn hoa không có độc .",0
Về gặp triết_lý của Mou cũng khó cho Bale . Có lẻ Bale lại về vị_trí lúc xưa là hậu_vệ phải .,0
Ăn đồ lạ mà không hiểu về chúng cẩn_thận ngộ_độc đi viện lại khổ !,0
Con sinh ra trên đời với ông bố bà mẹ như thế_này là quá bất_hạnh với con rồi . Còn 4 đứa em còn lại không biết có sống tốt hơn không .,0
"Sai_lầm trong kinh_doanh , Ý nghỉ táo_bạo trong thương_hiệu đi quá_đà . Rồi_đây gặp phải bao khó_khăn , hậu_quả , có_thể khởi_kiện , sử lý hình_sự v v . Bài_học cho những_ai có ý nghỉ dựa_dẫm , lạm_dụng uy_tín thương_hiệu và sai_lầm trong kinh_doanh .",0
"Hàng ngày đọc báo chỉ hóng tin như này là thấy đời phơi_phới . Mong tất_cả mọi người cảnh_giác , nâng cao ý_thức phòng_dịch để Việt_Nam không có thêm bất_cứ tin_buồn Covid19 nào nữa .",0
"14 ngày k ca nhiễm mới , tín_hiệu thật tích_cực cho ngày đầu tháng cô hằng",0
"Anh giỏi thiệt , ngưỡng_mộ a quá",0
Phải xử nghiêm cả phụ_huynh và cô_giáo !,0
""" Chỉ những đôi giã cào lớn , rê quét dọc_ngang ngư_trường xa mới bắt được nó . "" Bắt kiểu tận_diệt này thì vài năm nữa ngư_dân đi làm công_nhân hết .",0
