text,label
Thực_phẩm có màu đen đang được khá nhiều người tiêu_dùng ưa_chuộng vì chúng lạ_mắt ... Những người đó nói_chung là có nhiều tiền hơn người khác và họ ăn bằng mắt !,1
"Kỹ luật mấy cô cũng tội , tình_huống xảy ra quá bất_ngờ , ai mà nghĩ được người_lớn mà làm chuyện ấy.Chung quy nên xử thật nặng ông bố tầm_bậy này .",1
"Nếu đặt mình vào con cá , bị đè cho đến ngạt thở sẽ hiểu đc ko riêng gì con_người , mà bất_cứ con vật nào cụng muốn sống , chúng_ta thích_thú với cảnh tưởng con vật bị giết tới chết , đó thực_sự là 1 điều tàn_nhẫn , mong mọi người sẽ hiểu và chuyển sang ăn_chay để cùng nhau bảo_vệ môi_trường và sự sống",1
Rất cảm_ơn_lực lương chống tội_phạm ma_tuý đã ngăn_chặn được tội_ác nhưng tôi nghĩ các anh cần thận_trọng hơn với bọn ác_quỷ vì chúng sẵn_sàng liều_mạng,1
Nữa tấn chó tính ra tiền là bao_nhiêu ae . Chắc cũng một_số tiền lớn rồi . Mà bắt được chỉ phạt hành_chính ko phạt tù . Hỏi sao dân ức_chế bắt được là đánh te_tua .,1
Ác_ôn . Sao lại nỡ đánh đứa trẻ không có sức phản_kháng lại như_thế . Khốn_nạn quá .,1
Tội_nghiệp con quá . Không có mẹ . Bị bố đẻ đánh dã_man . Hắn lại còn nghiện_ngập và nguy_hiểm nữa .,1
"Việc đặt tên ca_khúc ngày_nay nghe có_vẻ khá thực_dụng , theo kiểu "" nghĩ sao đặt vậy người ơi "" , không còn kiểu đặt tên nghe hoa_mỹ hay bay_bổng như các nhạc_sĩ ngày_xưa nữa . VD như : Nghe những tàn phai ( Trịnh_Công_Sơn ) , Niệm khúc cuối ( Ngô_Thuỵ_Miên ) , Trên ngọn tình sầu ( Từ_Công_Phụng ) ...",1
Khốn nạn quá ! Mẹ thì như quỷ cái còn cậu thì không bằng loài cầm thú ! Bọn trẻ thật quá bất hạnh khi sinh ra trong hoàn cảnh đáng sợ như vậy ! Đề nghị trừng trị thật nặng hai kẻ khốn nạn này !,1
Hết thời rồi,1
Không_thể chấp_nhận được !,1
"Đề_nghị xử thật nặng , côn_đồ ngày_càng lộng_hành , thật đáng lo_ngại",1
"Có hôm con tôi_tối về viết 2 trang ( vì trong lớp bé viết không kịp ) làm bài_tập trong sách Mỹ_Thuật , Đạo_Đức , Tự_Nhiên xã_hội , còn làm bài dự thi của báo Nhi_đồng ( trường thông_báo đóng tiền mua báo và khuyến_khích tham_gia ) , 11h đêm con làm còn chưa xong , mẹ xót quá và mai còn phải dậy sớm đi học nên phải giúp con vì con sợ cô la nên chưa xong là con không dám đi ngủ ... sao con đã học bán_trú cả ngày mà về nhà hôm nào cũng mất cả buổi tối để hoàn_thành bài_vở vậy , còn giờ nào để con vui_chơi nữa ? ? ?",1
Kg thể hình dung được lương_tâm họ như thế nào . Cơ_quan CA cần giáo dục để họ có lương_tâm chính chắn hơn,1
Nút thắt cổ chai đoạn cầu bình điền quốc lộ 1a về miền tây và đường nối đại lộ đông_tây với cao tốc tphcm trung lương 10 năm hơn chưa làm xong,1
"Trước người ta hay sợ ăn cái gì đen đen cháy cháy vì sợ ung_thư , giờ thì nó lại cực hot . Đúng là hài .",1
Phải trị thật nặng bọn người lưu_manh cướp_giật nây .,1
Hôi pen à ?,1
"Mình cũng có con đang học lớp 1 . Chưa bao_giờ vào vnexpress comment , nhưng lần này phải ý_kiến . Cải_cách kiểu gì mà trẻ học toát mồ_hôi đến hơn 4 tuần chưa_thể đọc được và nhận_biết được chữ_cái . Trong khi đứa đầu năm nay lên_lớp 3 thì biết đọc và viết chỉ sau 3 tuần ( trước đó không đi học chữ trước khi vào lớp 1 ) . Mình thấy đứa thứ 2 thì thông_minh , nhanh hơn chị . Viết chữ nghệ_thuật thì quá khó . Đủ các môn_học ( 9 môn ) nào là kỹ_năng sống , đạo_đức , mỹ_thuật .... Đang học chữ sao nó đọc được mấy loại sách kia . Con tôi học tiếng anh tích_hợp nên có 35 bạn / lớp còn thấy khó huống_chi có lớp 59 bạn / lớp thì học kiểu gì ? Các bác cứ nói không nên cho con học trước khi vào lớp 1 và trường mẫu_giáo công thì k bao_giờ dạy chữ trước . Học ngày nào cũng tới 11h đêm , nói tới học là cháu nó mặt buồn , sáng đi học thì uể_oải ..",1
Những cơ_sở nào làm_việc này thì đó cũng_nên quy vô_tội cố_ý giết người .,1
17 + 18 = trung_niên ... hết thời thanh_xuân ! Cái giá cho bản tính trẻ trâu và côn đồ !,1
Xin thành thật chia buồn cùng gia đình chị Nhung . Đọc qua là thấy rất căm phẫn kẻ giết người . Hành vi quá dã man đê hèn . Dù đã ly_hôn với vợ cũ đã nhiều năm rồi . Lý do nguyên_nhân gì mà quay lại truy sát gia đình vợ cũ rồi truy sát gia đình vợ cũ . Chắc chắn kẻ này phải nhận bản án cao nhất .,1
"30 tháng tù cho 2 mạng người ? ? Chưa kể ko bằng lái , sử_dụng ma_tuý .",1
Đúng loại bất_nhân . Pháp_luật hay cho 2 con_người này mức án cao nhất . Thật tội cho cháu bé khi có 1 người cha như_vậy .,1
K nghe được tí lời - tôi nghe nhạc nhiều nhưng thể_loại này không ngấm nổi,1
"Tư_tưởng bá_chủ , bá_quyền thế_giới đã lỗi_thời , hãy mau tỉnh_ngộ .",1
"Hài nhỉ Trump được "" đề_cử giải Nobel_Hoà bình 2021 vì các nỗ_lực trung_gian đàm_phán hoà_bình giữa Serbia và Kosovo , làm tốt vai_trò trung_gian trong hiệp_ước giữa Israel và Các Tiểu vương_quốc Arab thống_nhất ( UAE ) . "" . Biden được đề_cử vì nỗ_lực nhằm xoa_dịu căng_thẳng chính_trị giữa làn_sóng biểu_tình ở Mỹ . Đối_ngoại vs Đối_nội . Hahaha",1
"Hổ dữ không ăn thịt con , người dữ cũng không ăn thịt con nhưng còn làm những việc thất Đức và kinh_khủng hơn cả ăn thịt , rồi_đây bé sẽ mang theo ký_ức này như một nỗi ám_ảnh sẽ theo con suốt cuộc_đời , vết_thương da_thịt của con sẽ lành nhưng vết_thương lòng thì sẽ là mãi_mãi .",1
"Bọn côn_đồ , cho hưởng án cao nhất , không khoan_hồng với tất_cả nhóm này . Không có vụ gián_tiếp hay trực_tiếp gây án .",1
"đánh vào tâm_lý ham của rẻ , đứng ở góc_độ người bán thì trừ khi làm từ_thiện hoặc bán_tháo chuyển nghề chứ trên đời bây_giờ làm gì có cái gì ngon , bổ mà_lại rẻ !",1
"Meghan không phải người Anh nên việc kỳ_vọng cô ấy có_thể làm gì cho nước Anh , người_dân Anh hay hoàng_gia Anh là điều không thực_tế .",1
"Chúc_mừng Barca với chiến_thắng này , nhìn Su thỏ ghi_bàn cho ATM mà tiếc , còn Griezmann và Coutinho vẫn vô_hại như mọi_khi , chỉ có fan Rô kém hiểu_biết mới cho rằng Griezmann và Coutinho là gánh team , các cầu_thủ Barca cần cố_gắng tập đi trên đôi chân của chính mình đi chứ bao_nhiêu năm_qua_ỉ_lại đi trên đôi chân của Messi quen rồi , cứ ung_dung ngồi đợi Messi đem cúp về hưởng ké thôi .",1
Kg biết các tội này khung_hình_phạt cao nhất như_thế_nào . Nhìn mặt 2 người này thấy ghê gợn,1
"Bài hát bình_thường , góc_quay lúc thu âm quá kém , chèn phim chẳng có logic gì , xem 1 lần vì dư_âm của "" ko màu "" sẽ ko có lần sau .",1
nguồn_gốc là đứa con gái chọn nhầm người .,1
Bọn này không phải là người !,1
"Ko biết đến bao_giờ Bộ GD mới có cánh nhìn khác về cách học kỹ_năng và tư_duy như 1 số nước phát_triển để các con vừa có kỹ_năng giao_tiếp vừa có kỹ_năng sông trong cộng_đồng chứ ko phải như bây_giờ các con học tối_ngày ko có thời_gian nghỉ vì áp_lực học quá nhiềuỞ hầu_hết các trường TRÊN THẾ_GIỚI các con có phải đi học thêm nhiều như ở VN ta đâu học học trên lớp đã đủ để các con hiểu bài rồi , họ đc học tư_duy logic chứ ko phải 1 đống kiến_thức như ở chúng_ta",1
nghe xong máu điên trong người nổi lên . muốn đánh cho thằng_cha một trận quá .....,1
Lên youtube mà coi mọi người . Thật là tàn_ác,1
"Tôi cũng có con năm nay học lớp 1 , thật_sự ct học quá nặng , mới 2 tuần chưa nhớ được chữa cái này đã học qua chữ khác , mới 2 tuần mà đã ghép vần rồi . Nếu bé nào k học trước thì khẳng_định là k bao_giờ theo kịp , nhưng ở cấp mầm_non thì lại k cho dạy chữ trước .",1
Cuối_cùng cũng tìm được kẻ lấy túi_tiền của bà lão . Thiên bất dung gian .,1
"Ngại_Ngùng lại nhớ đến TUẤN VŨ . Còn a trường thì tốt nhất nên tìm tiếp các bản_nhạc trẻ để hát , hoặc thôi để người ta nhớ đến a với những bản_nhạc xưa . Đừng cố qua hát thể_loại này",1
Bọn quỷ dữ này cấn phải loại_trừ sớm ra khỏi xã_hội .,1
"Gì cũng ăn , bó_tay !",1
Tư_vấn nghe có_vẻ sai bản_chất Bảo_hiểm quá .,1
"Hỡi những người làm nghề nạo_phá thai hãy suy_nghĩ lại đi , các bạn đang kiếm tiền từ sự dữ , các bạn có sống được không khi các bạn giết người và tạo ra sự chết .",1
"Ô đừng em , đừng làm mới những cái đã đi_sâu vào lòng người rồi . Hảy hát như bao_nhiêu người khác khi hát dòng Bolero này . Anh xin đó .",1
"Toàn bọn vô_công_rồi_nghề , nhận_thức yếu_kém , làm_việc bất_lương lại nghĩ mình anh_hùng , tài_giỏi . Nên cho chúng bản_án đích_đáng , với khung hình cao nhất .",1
Điện_thoại giá rẻ hay rác_thải công_nghiệp ? Xu_thế thương_mại_điện_tử là sự thay_thế tất_yếu cho hệ_thống cửa_hàng phân_phối . Hệ_thống cửa_hàng chỉ có tác_dụng lấn_át đối_thủ mà thôi . Doanh_nghiệp cần linh_động quy_mô hoạt_động để có_thể tồn_tại khi thị_trường bảo hoà và cạnh_tranh gay_gắt .,1
Tôi có chị_gái gom_góp giành dụm Cả đời rồi mua 1 căn Chung_cư Qụận 12 ........ tới giờ 4 năm chưa có Quyển sổ Hồng . Chán zzz,1
"Đôi này phức_tạp quá , không mang phong_thái của người nổi_tiếng .",1
"Tôi thấy ko phải nặng mà quá nặng , phải học cả thứ 7 , đầu_sách thì nhiều , lớp 1 mà 3 quyển sách tiếng anh nặng gần 1kg chưa kể các loại sách khác , nếu tập_hợp tất_cả các bộ sách theo thời_khoá_biểu thì nhiều e mang vác ko nỗi luôn nếu trường_học 2 tầng nữa thì ko thể leo lên tầng 2 , khả_năng tai_nạn té cầu_thang rất cao !",1
Thật đáng buồn cho cách đối_xử với các cô_giáo,1
Kế_hoạch lãi 10tr đồng nhưng khi thực_hiện thành 140 tỷ,1
Chỉ những người vô_trách_nhiệm mới đẻ nhiều mà không nuôi được con_trẻ . Những người trọng nam khinh nữ là những người vô_trách_nhiệm nhất .,1
"Đến nản . Con tôi chắc tôi tự dạy cho_rồi , cháu nó không có nhu_cầu học để làm siêu_nhân .",1
"chữ đánh_máy một kiểu , chữ_viết tay một kiểu . làm_khó cho các cháu rồi .",1
Thật_sự là nhạc rap tôi chỉ nghe mỗi eminem chứ nghe mấy rapper việt với rapper khác trên nước_ngoài tôi không vào nổi : ),1
Cầu_mong cho Mu đừng gặp Bayern ko lại bị hạ thảm_hại rồi bị troll các bạn fan mu lại biến mất . Lâu lắm rồi mới đc dự c1 mong cho các bạn Mù_u qua đc vòng bảng đỡ khổ_thân . Mu đc dự vòng bảng đã phải cố_gắng lắm rồi mong Mu chỉ gặp Sevilla cho đỡ thua đậm các fan mu nhỉ,1
"Trẻ_em lang_thang ngoài đường xin ăn , bán vé_số đầy_rẫy vẫn còn thì sẽ còn những chuyện ntn . Chính_quyền , công_an đâu cả rồi ? Hay đã quen mắt quá rồi nên thấy bình_thường ? Trẻ_em hôm_nay thế_giới ngày_mai chắc nói cho vui",1
Ác gì ác dữ vậy . Sao không kiếm ai to xác như mình mà đánh .,1
"Kinh_khủng quá , con mình thương nó còn không hết , sao lại mất nhân_tính thế",1
"Đám này cho đi dài_hạn , chứ để nó ra tù sớm cũng chỉ trộm với cướp",1
"Khi lời_nói tỏ ra không còn hiệu_lực thì quả_đấm ra_đời , khi quả_đấm tỏ ra không nguy_hiểm thì rút dao đâm liền .",1
"Vào quán nhậu là để giao_lưu vui_vẻ , nào_ngờ cà_khịa chém_giết nhau , thật buồn vì nhóm người ngông ngược này . Cần xử thật nặng .",1
"Các tên côn_đồ này nên xử kịch khung mới có tính răn_đe , xã_hội mới an_lành được .",1
nhái kiểu này thì đúng là không_thể chấp_nhận .,1
Ai hay bị nấc_cụt nghe thấy hay,1
Ôi chém người như chém ko khí,1
Mẹ cháu đâu mà dể cháu bị bạo_hành nhiều ngày đến gãy tay ? Tên khốn_nạn này sẽ được nhận bản_án nghiêm_khắc cho tàng_trữ ma_tuý và bạo_hành con để nhiều ngày đến gãy xương !,1
"Ko biết năm nay Roland garros bốc_thăm ra sao . Ko hiểu sao rất nhiều lần bốc_thăm giải này thì Nole luôn vào nhánh đánh sau , rồi vào bán_kết đánh sau dẫn tới đánh bán_kết 2 ngày , kết_quả là chỉ nghỉ có 1 ngày trc khi đánh ck và thua dễ ở ck . Mấy lần như_vậy rồi đấy . Mình chưa thấy Nadal fai đánh bán_kết kéo_dài 2 ngày bao_giờ . Ban tổ_chức giải này sắp lịch cũng quá buồn_cười .",1
Ác quá . Yêu_thương không hết sao lại có người đánh con như_vậy .,1
Thể_dục quên mất thể_chất và ý_thức rồi ai ơi .,1
Phải cho kịch khung . Đây là thành_phần nguy_hiểm của XH,1
"Thật đáng thương cho những đứa trẻ có cha_mẹ như_vậy . Trẻ_con có tội gì chứ . Đọc bài mà thấy ấm_ức , ko biết cuộc_sống đứa trẻ này sẽ đi về đâu ....",1
"Hoá_ra từ "" bigcityboy "" từ đây mà ra . Tôi vào xem thấy MV đẹp , đầu_tư . Nhưng ca_từ không rõ . Nhạc cũng không hay . Nói thật , nếu bài hát này không đi kèm MV bắt_mắt có_lẽ chẳng ai nghe",1
"GS nói tăng từ 8 lên 11 tiếng / từ là không nhằm_nhò gì à ? Tăng hơn 35% khối_lượng còn gì ? Sách cũ than nặng , sách này tăng thêm 35% khối_lượng nữa ..... haizaaaaa",1
"Mới chỉ là các cầu_thủ trẻ tiềm_năng chứ nói là thế_hệ vàng thì hơi quá , thành_tích cá_nhân và tập_thể chưa có gì mà được mấy ông lớn tranh_giành đẩy giá kinh quá .",1
Tôi ít để_ý đến nội_dung phim 3 cô này đóng vì những hình_ảnh gợi_cảm của họ đã làm choáng hết tâm_trí của tôi rồi ... ! : ),1
"Giờ sao ai cũng đc đề_cử giải này nhỉ , hết Trump rồi đến Putin giờ đến Biden .",1
Đạp xe_tăng cường sức_khoẻ nhưng nguy_hiểm do vô_ý_thức .,1
thông_tin bữa giờ rồi mà nhiều người không biết còn ăn nữa trời,1
Sao lại có cách nhìn nóng_vội trong giáo_dục vậy nhỉ . Thật khổ các cháu lứa chuột_bạch này !,1
Rap nói thật không có ca_sĩ hát phụ mà live trực_tiếp nghe rất chán . Năm nay thi Rap mùa đầu_tiên nên mọi người sôi_nổi . Sang năm lại chán ngay ấy mà .,1
Vừa_đấm_vừa_xoa : ' ) : ' ) Cứ đà này giải Nobel không bao_lâu nữa thành giải ao làng : ' ) : ' ),1
Tiểu_Vy mặc quần nhăn_nhúm . MPT đẹp !,1
Còn nhỏ mà bản_chất như_vậy r . Nguy_hiểm,1
Nhìn tài_xế rõ_ràng đánh lái qua làn xe_máy để giảm thiệt_hại cho nó ! Đúng là khốn_nạn !,1
"Anh Bo vẫn hát hay như ngày nào . Hy_vọng anh đầu_tư nhiều vào hoà_âm , phối_khí . Những nhạc_phẩm của anh dùng nhạc_cụ điện_tử nhiều quá , làm mất đi một phần giá_trị .",1
Quy_định này quả là kì_lạ,1
"Hy_vọng lần tranh_luận sắp tới sẽ thay_đổi chủ_đề . Những chỉ_trích của ông Biden chính là những gì mà cả thế_giới đều đã biết , vì_vậy cuộc tranh_luận hôm_qua chỉ là cơ_hội để ông Trump biện_hộ .",1
Trump gây hỗn_loạn như thế là đủ rồi . Bây_giờ nhiễm Sar-Cov -2 thì mới biết thông_cảm và chia_sẻ với các bệnh_nhân và người nhiễm virus này . Nhiễm nCovy cũng có_thể là lý_do để ngài ' rời ngai ' trong danh_dự đấy Trump ah . Chúc Ngài sớm bình_phục .,1
"Thế_này còn chưa là gì . Bên đường Mai_Chí_Thọ họ còn cử người cầm còi hiệu đi dẹp đường nữa kìa . Tới đèn_xanh đèn_đỏ không thèm dừng , ngang_nhiên chạy ra giữa đường chặn xe lưu_thông để cho nhóm vượt qua , cứ như là cuộc đua chính_thức vậy . Tập_thể_dục mà ý_thức như thế_này thì thà nằm nhà ngủ cho xã_hội phát_triển giùm đi .",1
hình_sự cho chừa . lớn mà đánh con_nít .,1
"Bé 6 tuổi bắt_đầu cắp sách đến trường rồi , hôm trước bé có được dự lễ khai_trường không ? . Tội_nghiệp bé quá , một thằng "" bố_láo "" , cần xử nghiêm .",1
""" số tiết cho lớp 1 và 2 tăng hai tiết một tuần so với chương_trình cũ . Ngược_lại số tiết cho lớp 3 , 4 , 5 trong chương_trình mới lại giảm "" Nên để giáo_viên và phụ_huynh đánh_giá . Mới vào lớp 1 thôi mà đã cảm_thấy áp_lực học_tập nặng_nề cho trẻ_con quá .",1
biểu_cảm diễn_xuất của cậu này quá chán đời,1
"Nói_chung Messi là một cầu_thủ vĩ_đại , cậu ấy đã đem đến cho Barca một bộ sưu_tập về danh_hiệu quá đồ_sộ , đối vớ tôi : nếu Messi không tra_tấn các cầu_thủ MU của tôi và cướp đi 2 cái cúp C1 thì tôi đã là fan của cậu ấy rồi , còn về phần Ro _ vạ và fan cuồng thì là ơn đừng nhận_vơ là một phần cùa MU nữa , nhìn xem các công_thần của Mu có coi Ro _ vạ ra gì đâu ? , Gigss , Nevil , Scholes , Rooney luôn đánh_giá Ro _ vạ quá thấp so với các cầu_thủ khác và đặt biệt là CĐV cũng rất ghét Ro _ vạ vì cậu ấy chỉ diễn nhớ Mu một_cách giả_tạo để vòi_vĩnh tăng lương tại CLB mới chứ có phải nhớ MU thật đâu ?",1
Cái này gọi là phá_cách để phù_hợp với khẩu_vị thị_trường Trung_Quốc . Thật hài_hước khi xe phân khúc hạng nhỏ hơn lại lớn phân khúc hạng lớn hơn . Phá_cách kiểu này là đang phá nát thương_hiệu rồi còn gì ... BMW ơi_là BMW . Thân !,1
Doanh_nghiệp bị ảnh_hưởng thì giảm . Còn doanh_nghiệp ăn_nên_làm_ra nhờ dịch thì sao phải giảm ? ? ?,1
"Lối sống cả 2 đều đáng lên_án , nạn_nhân là người đồng_tính thì nên tìm người cùng hệ với mình chứ bạ đâu gạ đấy thì kết_cục này khó tránh khỏi",1
NÓI_CHUNG HAI CÔ NÀY KHÔNG ĐƯỢC ĐẸP.VIỆT NAM BÂY_GIỜ RA ĐƯỜNG NHÌN RẤT NHIỀU CÔ ĐẸP .,1
"Cũng từ lối sống bệnh_hoạn mà ra , người chết coi như trả giá.Ko biết lời khai chính_xác đến đâu nhưng 20 nhát thì chung_thân là xứng_đáng",1
"Phim hay và ý nghĩa là công nhận . Còn chuyện đạo diễn nói không vì doanh_thu , ko vì lợi nhuận , nói chung không vì mục đích kinh_doanh thì khó tin được , vài lời gửi đến đạo diễn , mong rằng đạo diễn nên chân thành và thực tế hơn ...",1
"Bọn này dã_man quá , con mình mà_còn làm_vậy",1
Mọi thứ đều đẹp trừ 2 quả thận,1
"Su đi để lại Fati , 17 tuổi phải gồng mình gánh tạ . Nghe bảo Si hay nhường PEN , sao không nhường cho em được cú hattrick trong sự_nghiệp thế . Đúng là Si hết thời_giờ chực_chờ ăn_may rồi ! ! ! : P : P : P",1
Lì_lợm thật : (,1
"Triệu_tập còn không thèm tới , chứng_tỏ thói côn_đồ ngang_ngược .",1
"Lời nhạc mà như đối_thoại , chả có gì đặc_sắc",1
"Tài_năng xuất_chúng và nhân_cách và nhân_cách vĩ đại.Thực ra đến bây_giờ mình vẫn không hiểu tại_sao lại có người bảo ghét Messi , chẳng_lẽ họ đố_kỵ và cay_cú quá sao.Trước mình Fan_Ars , bị Messi cho ăn hành nhiều , cũng cay_cú , nhưng xem 1 trận Messi chơi bóng ( xin nhắc lại là chơi bóng chứ không phải đá bóng rồi ăn_vạ bẩn nhé ) là mình suy_nghĩ lại ngay.Mình và người hâm_mộ trên toàn thế_giới thật may_mắn khi được chứng_kiến Messi chơi bóng .",1
Ôi thế_thì lại toang mất thôi . Những trận đấu mưa bàn thắng nối dài . Không_lẽ lịch_sử 82 lặp lại . Lo thay lo thay .,1
làm_ăn cẩu_thả xem_thường tính_mạng người tiêu_dùng hãy phạt thật nặng,1
"Ko can thì ôm bé vào lòng cũng dc mà , chuyện con_nít nó mới 2 tuổi hiểu cái j mà đánh nó . Đàn_ông j chỉ biết bắt_nạt con_nít !",1
Tên này không còn là con_người nữa rồi,1
"Phải truy_tố hình_sự để răn_đe , thật hèn_hạ .",1
tôi ko tin MU muốn mua Fati 170tr,1
Trông như hai tên cô_hồn .,1
đẹp thua vợ tôi nhưng tiêu tiền nhiều hơn vợ tôi . Ngấm lại thì tôi thật hạnh_phúc với vợ tôi hiện_tại,1
Hành_động vô lương_tâm thật !,1
"MÌnh không đồng_ý với ý_kiến của tác_giả . Bây_giờ nói đơn_giản , trong 1 lớp_học có bao_nhiêu học_sinh mà cô_giáo có_thể giám_sát được xem chúng làm gì với điện_thoại ? tìm_hiểu gì ? vậy 45p học cô chỉ đi ktra điện_thoại của từng người một ak ? nhà tác_giả có 2 đến 3 con mà có_khi chả biết được con nó xem cái gì ( ngoài giám_sát thời_gian sử dụng-đấy là khi có tác_giả ở nhà ) thì cớ gì lại bắt các giáo_viên phải theo_dõi ? ? đến khi có vấn_đề gì thì lại đổ lỗi cho giáo_viên ? ? ? ? nghịch_lý !",1
Morning hay i10 nhìn xấu quá !,1
"đây thật_sự là hành_vi rất độc_ác , cần đưa vào tội cố_ý giết trẻ_em . Thời_buổi mà bao_cao_su đầy_rẫy , không khó tìm , vậy_mà vẫn để xảy ra nhiều ca phá_thai đau_lòng !",1
"Cháu tôi đang học lớp một , ngày nào cô cũng nhắn các phụ_huynh kèm cháu đọc viết . Chả hiểu bộ biên_soạn sách với chương_trình dạy kiểu gì , khi mà học cả sáng lẫn chiều rồi mà tối vẫn phải học . lấy đâu thời_gian cho các bé vui_chơi nữa .",1
"Trump làm kinh_tế giỏi nhưng chức_vụ tổng_thống không thích_hợp với ông ,",1
"Nghe như đám bạn tôi hát karaoke , thậm_chí còn không bằng . Xin_lỗi fan của Đan_Trường nhưng mong Đan_Trường đừng phá hỏng những bản_nhạc bất_hủ này nữa",1
Có ai cho tôi biết hình_phạt cao nhất cho lũ tội_phạm này không ?,1
Đọc bài mà căm_phẫn quá . Sao trên đời lại có dạng người khốn_nạn đến thế . Con_cháu ruột của mình mà cũng ko tha .,1
Nói thật là nhìn thế_nào thì cũng không thấy thiện_cảm với ông này .,1
"Cũng cảnh tốc váy nhưng mang tính_cách thiên_thần , quyến_rũ . Cũng cảnh quay này nếu ở điện_ảnh mì_ăn_liền ở ta đóng thì nó dung_tục , câu_khách .",1
"Hai kẻ mất nhân_tính , cầm_thú . Xử_lý nghiêm_khắc nhất có_thể . Hãy bảo_vệ trẻ_em - chủ_nhân tương_lai của Đất_nước .",1
Binden lú_lẫn quá rồi,1
Mất hết nhân_tính . Cặn_bã của xã_hội .,1
Người Việt nhưng phát_âm lớ lớ như người nước_ngoài . Nghe cứ tưởng nhạc nước_ngoài . Chán không thèm nghe .,1
"Hoa_hậu Lương_Thuỳ_Linh không được xinh lắm , chỉ được mỗi_cái học giỏi và chân dài",1
Giá nhà_đất bị môi_giới cùng mấy anh lướt_sóng đẩy cao_vút nay anh nào đang ôm không sao buông ra được vì cứ muốn lãi đậm cứ chờ xem ... ôm được đến bao_giờ nếu đi vay ngân_hàng,1
"không nên nghe từ đàn_bà , và càng không nên tin những gì phụ_nữ nói",1
Quá ác hãy xử_lý thật nghiêm cho người khác,1
"Cái giải Nobel hoà_bình này sao dễ lấy thế nhỉ , chỉ cần nói_suông hay "" truyền_cảm hửng "" là có_thể được",1
